{"artifacts":{"certificate":{"path":"certificate.json","sha256":"sha256:4504c40b33d1bb080100ff0fd8e572f15bea66296956695cef7886506cd1396d"},"compile_receipt":{"path":"compile_receipt.json","sha256":"sha256:059e607a2a369a0be6c3eaf29a1db595dfbdf7724c09007fdd4ac7db5d4641f4"},"kernel_eval_receipt":{"path":"kernel_eval_receipt.json","sha256":"sha256:8c75974169f5763350ea9311b4f4b6893b8f23e6c4d8285b8bebcb733be784c4"},"kernel_receipt":{"path":"kernel_receipt.json","sha256":"sha256:b6a6c88168dc3c43acd2f7affec914a65d6c3764edda10c5a25c07b00d30b4e8"},"kernel_replay_receipt":{"path":"kernel_replay_receipt.json","sha256":"sha256:68cf0e0e4dbb44344ceb837a10d520a5ed12e812dbfe4e0dc1b808a1da893ec9"},"kernel_settlement_receipt":{"path":"kernel_settlement_receipt.json","sha256":"sha256:82a4c0971af5098b2970a9eb00452ff80fd6b8a9b80a24a7120fa788f071b600"},"object_card":{"path":"object_card.txt","sha256":"sha256:d36ae798314f135a34328330c7467700c9ec24795706cdeaab0bdac16b52884c"},"object_instance":{"path":"instance_manifest.json","sha256":"sha256:d95595388d182a1f41006a76015212849be148a957d3628bc1f62900745b21ab"},"object_lock":{"path":"object_lock.json","sha256":"sha256:7c68c7c1d282807e4ed728fd63047501d13f6c442728a6f60f2604df3cc00d02"},"object_manifest":{"path":"object_manifest.json","sha256":"sha256:13e610ceb6214a496e6016a729590a1437caf79f0cb5b9ee14dcd13ac1d2986c"},"proof_tree_certificate":{"path":"proof_tree_certificate.json","sha256":"sha256:fcfb890afb8de94db89fdceac54e03b3e7f4aee0c96cf5e0e809b52fcf099901"},"replay_input":{"path":"replay_input.json","sha256":"sha256:afe7b4d9ad052ac13262316a1600a9c0d6e720e918e3d3b3f05fd818d228b26a"}},"bundle_hash":"sha256:053333f84bbfc4aebb6ea6c7f84407f85980c235cd1b0dcb0868d85d69a79356","contracts":[{"name":"burn_contract","roles":["import:burn_index_v1.burn_final","witness:BurnCertificate[TDEX]"],"use_sites":["import:burn_final","witness:BurnCertificate[TDEX]"]}],"object_family":"capped_index_call","object_name":"BurnBoostCall","object_version":"v1","schema":"zenodex/fire-registry-bundle/v1"}